{
  "pass_id": "round-1-worker-5",
  "scope": [
    "results/worklists/worker-5.csv",
    "pinned upstream/claude-for-legal assigned files only"
  ],
  "coverage": {
    "files_reviewed": 51,
    "lines_reviewed": 8227,
    "deferred": []
  },
  "findings": [
    {
      "id": "R1-W5-F001",
      "title": "Durable shared and practice profiles encode firm operating context",
      "claim_status": "Confirmed",
      "evidence": [
        {"path": "corporate-legal/CLAUDE.md", "line_start": 4, "line_end": 18, "description": "Directs user configuration to durable paths, migrates it across plugin updates, and shares company facts across twelve plugins."},
        {"path": "corporate-legal/CLAUDE.md", "line_start": 227, "line_end": 230, "description": "Requires ordinary practice-area answers to apply configured jurisdiction, risk posture, playbook positions, and escalation chain."},
        {"path": "ai-governance-legal/README.md", "line_start": 128, "line_end": 130, "description": "States that the practice profile improves through use and may record new positions."}
      ],
      "source_to_sink": ["typed answers and expressly supplied seed documents", "cold-start/profile update instructions", "durable local config under ~/.claude/plugins/config/claude-for-legal", "subsequent skills and plugins read the shared/practice profile"],
      "proves": "The static design deliberately persists reusable firm context and uses it across later workflows, supporting a customer-specific professional interaction graph at the local configuration layer.",
      "does_not_prove": "It does not establish provider-side retention, provider access to the files, cross-customer pooling, training, or product improvement.",
      "alternative_explanation": "Durable local configuration is the expected benign mechanism for consistent customer-specific assistance.",
      "confidence": "high",
      "risk": "medium",
      "test_to_confirm": "Trace runtime file access and network egress while creating, editing, and using these profiles; inspect contractual custody and retention terms.",
      "hypotheses": ["H0", "H1"]
    },
    {
      "id": "R1-W5-F002",
      "title": "Employment setup captures substantive judgment signals from answers and prior work product",
      "claim_status": "Confirmed",
      "evidence": [
        {"path": "employment-legal/skills/cold-start-interview/SKILL.md", "line_start": 74, "line_end": 84, "description": "Explains that risk calibration and house conventions are written to a reusable profile, limits inputs to typed or approved material, and disclaims ambient personal-history collection."},
        {"path": "employment-legal/skills/cold-start-interview/SKILL.md", "line_start": 199, "line_end": 203, "description": "Offers to build positions, stances, fallbacks, review triggers, and escalation points from user input or existing playbooks."},
        {"path": "employment-legal/skills/cold-start-interview/SKILL.md", "line_start": 240, "line_end": 250, "description": "Requests employment documents and extracts house format, severance posture, high-risk patterns, and actual approval patterns."}
      ],
      "source_to_sink": ["user answers and explicitly supplied employment documents", "cold-start extraction and synthesis", "employment practice-profile configuration", "future hiring, termination, policy, and escalation workflows"],
      "proves": "The repository explicitly solicits and structures firm-specific positions, fallbacks, escalation criteria, house style, and observed approval patterns.",
      "does_not_prove": "It does not show that the extracted information leaves customer custody or is reused by Anthropic beyond serving that customer.",
      "alternative_explanation": "The captured signals are necessary to avoid generic, jurisdiction-insensitive legal workflow output.",
      "confidence": "high",
      "risk": "medium",
      "test_to_confirm": "Observe prompts, tool calls, file writes, and outbound requests during cold start and later profile-driven reviews; compare against tenant data controls.",
      "hypotheses": ["H0", "H1"]
    },
    {
      "id": "R1-W5-F003",
      "title": "Litigation intake creates a structured, longitudinal matter and decision record",
      "claim_status": "Confirmed",
      "evidence": [
        {"path": "litigation-legal/skills/matter-intake/SKILL.md", "line_start": 11, "line_end": 16, "description": "Captures identification, conflicts, risk, owners, legal hold, dates, and posture into matter, history, and portfolio-log files with confirmation."},
        {"path": "litigation-legal/skills/matter-intake/SKILL.md", "line_start": 52, "line_end": 76, "description": "Preserves conflicts findings, waivers, owners, due dates, and bypass rationale as continuing records."},
        {"path": "litigation-legal/skills/matter-intake/SKILL.md", "line_start": 139, "line_end": 147, "description": "Captures the initial fight, settle, investigate, or wait posture."},
        {"path": "litigation-legal/matters/_log.yaml", "line_start": 3, "line_end": 7, "description": "Defines the matter log as the durable rollup source of truth with searchable closed-matter history."}
      ],
      "source_to_sink": ["matter facts and user conflict/risk judgments", "uniform intake", "matter.md and history.md plus structured _log.yaml", "portfolio rollups and later matter updates"],
      "proves": "The static workflow builds an explicit longitudinal graph of matter identity, conflicts, posture, owners, rationale, and outcomes inside local matter storage.",
      "does_not_prove": "It does not prove the proprietary runtime transmits that graph to a provider or derives generalized litigation strategy from it.",
      "alternative_explanation": "A durable matter ledger is ordinary legal-operations recordkeeping and improves auditability and consistency.",
      "confidence": "high",
      "risk": "medium",
      "test_to_confirm": "Instrument intake and portfolio-status runs for local reads/writes and egress; inspect access controls and deletion behavior for closed matters.",
      "hypotheses": ["H0", "H1"]
    },
    {
      "id": "R1-W5-F004",
      "title": "Configured connectors and scheduled agents create bounded remote source and notification paths",
      "claim_status": "Confirmed",
      "evidence": [
        {"path": "ai-governance-legal/.mcp.json", "line_start": 2, "line_end": 14, "description": "Declares remote Slack and Google Drive MCP endpoints for workspace messages and documents."},
        {"path": "corporate-legal/agents/dataroom-watcher.md", "line_start": 3, "line_end": 8, "description": "Defines a scheduled VDR watcher with wildcard Box, Intralinks, Datasite, and Slack-send tools."},
        {"path": "corporate-legal/agents/dataroom-watcher.md", "line_start": 17, "line_end": 33, "description": "Describes daily VDR queries and posting deal updates, with local-file fallback when integrations are unavailable."},
        {"path": "corporate-legal/agents/dataroom-watcher.md", "line_start": 51, "line_end": 54, "description": "Limits the watcher to flagging new documents and reporting checklist status rather than reading documents or updating the checklist."}
      ],
      "source_to_sink": ["VDR metadata and configured deal state", "scheduled watcher using external MCPs", "Slack deal channel or local update file", "deal-team notification"],
      "proves": "The design includes remote connector calls and an ambient scheduled notification path; the watcher tool declaration is broader than its stated read-only/document-flagging behavior.",
      "does_not_prove": "It does not prove connector activation, tenant permissions, actual payloads, provider logging, retention, training, or covert exfiltration.",
      "alternative_explanation": "Remote reads and team notifications are explicit user-facing workflow functions, with documented local fallbacks and stated limits.",
      "confidence": "high",
      "risk": "medium",
      "test_to_confirm": "Capture runtime MCP authorization, exact tool calls and payloads, Slack destinations, credential scopes, logs, and retention during a scheduled run.",
      "hypotheses": ["H0", "H1", "H2"]
    },
    {
      "id": "R1-W5-F005",
      "title": "Managed-agent cookbooks support hosted deployment while isolating untrusted documents from write and network authority",
      "claim_status": "Confirmed",
      "evidence": [
        {"path": "managed-agent-cookbooks/diligence-grid/README.md", "line_start": 8, "line_end": 17, "description": "Describes headless fleet review for POST /v1/agents and repeatedly bounds extracted cells as unverified leads."},
        {"path": "managed-agent-cookbooks/diligence-grid/README.md", "line_start": 36, "line_end": 47, "description": "Separates untrusted-document readers from write holders and connectors and requires schema/length controls and spreadsheet-injection defenses."},
        {"path": "managed-agent-cookbooks/diligence-grid/README.md", "line_start": 55, "line_end": 61, "description": "Requires deployment-time connector/output wiring and states the agent never directly uploads or posts to Slack."},
        {"path": "managed-agent-cookbooks/diligence-grid/subagents/extractor.yaml", "line_start": 29, "line_end": 40, "description": "Treats document bytes as data and makes the extractor read-only with no MCP, network, or write authority."}
      ],
      "source_to_sink": ["VDR documents", "read-only connector/document reader", "schema-validated extraction and normalization", "isolated local grid writer", "deployment-owned upload or notification handoff"],
      "proves": "The repository contemplates hosted managed-agent execution but includes explicit authority separation that materially weighs against a simple document-to-exfiltration chain.",